{
  "id": "eck_faltscharnier",
  "hersteller": "Blum",
  "kategorie": "topfband",
  "bezeichnung": "Faltscharniere zwischen den Flügeln der Eckfront (Platzhalter: Blum-Bohrbild fehlt)",
  "bohrbilder": [],
  "geprueft": {
    "von": null,
    "am": null,
    "quelle": "Blum-Montageanleitung der Winkeltür, Referenz-TCN nötig"
  }
}
