{
  "id": "eck_lemans",
  "hersteller": "<Hersteller>",
  "kategorie": "sonstiges",
  "bezeichnung": "Eck-Auszug LeMans (Platzhalter: Bohrbild der Beschläge an Boden und Front fehlt)",
  "bohrbilder": [],
  "geprueft": {
    "von": null,
    "am": null,
    "quelle": "Herstellerunterlage nötig"
  }
}
