{
  "id": "bodentraeger_5mm",
  "hersteller": "Häfele",
  "bezeichnung": "Bodenträger Ø 5 mm",
  "kategorie": "bodentraeger",
  "artikelnummern": [
    {
      "artnr": "<artnr>",
      "menge": 4
    }
  ],
  "bohrbilder": [
    {
      "teil": "seite",
      "bezug": {
        "flaeche": "F1",
        "punkt": "montagepunkt"
      },
      "bearbeitungen": [
        {
          "typ": "bohrung",
          "x": 0,
          "y": 0,
          "d": 5,
          "tiefe": 12
        }
      ]
    }
  ],
  "geprueft": {
    "von": null,
    "am": null,
    "quelle": "Sitzt in der 32er-Lochreihe; keine eigene Bohrung nötig, Eintrag dient der Stückliste"
  }
}
