{
  "id": "blum_muellsystem",
  "hersteller": "Blum",
  "kategorie": "sonstiges",
  "bezeichnung": "Blum Abfalltrennsystem im Frontauszug (Platzhalter: kein Bohrbild nötig, Teil des Schubkastensystems)",
  "bohrbilder": [],
  "geprueft": {
    "von": null,
    "am": null,
    "quelle": "Blum-Planungsunterlage"
  }
}
