{
  "id": "eck_karussell",
  "hersteller": "<Hersteller>",
  "kategorie": "sonstiges",
  "bezeichnung": "Eck-Karussell 2 Böden (Platzhalter: Befestigung am Boden, Mittelsäule und Türmitnehmer fehlen)",
  "bohrbilder": [],
  "geprueft": {
    "von": null,
    "am": null,
    "quelle": "Herstellerunterlage nötig"
  }
}
